,#para,#word,author,content,time,title
0,4,134,Reuters Staff,"Daniel Murphy homered twice and drove in six runs, and Tanner Roark knocked in three and threw seven solid innings as the Washington Nationals defeated the New York Mets 25-4 Tuesday night at Nationals Park. The 25 runs were a franchise high for Washington, which finished with 26 hits and five homers. Roark lined a three-run double that was the key hit in a seven-run first inning. The Nationals scored at least three runs in each of the first five innings, then added six runs in the eighth off Mets infielder-turned-pitcher Jose Reyes. Murphy went 3-for-4. Anthony Rendon finished 3-for-6 with four RBIs. Roark was 2-for-5 while Ryan Zimmerman (2-for-5) homered and drove in three. Trea Turner added four hits and three runs, and Juan Soto and Michael A. Taylor had three hits apiece. ",2018-08-01T08:54:18+0000,MLB roundup: Nationals score team-record 25
1,3,93,Reuters Staff,"Wade Miley tossed seven scoreless innings and Jeremy Jeffress earned his fourth save as Milwaukee won at Los Angeles. Miley¡¯s mastery of Dodger Stadium continued as the left-hander improved to 4-0 in seven career starts at the venue and lowered his ERA to 2.06 there. He gave up just two hits with five strikeouts and two walks. The Brewers collected the only run in the third inning. Christian Yelich beat out an infield single with two outs, and Lorenzo Cain ripped an RBI double to right field against Dodgers starter Walker Buehler (4-4). ",2018-08-01T08:54:18+0000,MLB roundup: Nationals score team-record 25
2,3,84,Reuters Staff,"Masahiro Tanaka pitched six scoreless innings, and rookie Miguel Andujar hit a three-run homer as host New York beat Baltimore. Tanaka (9-2) followed up his three-hitter at Tampa Bay last week by allowing three hits. He struck out eight, walked two and threw 105 pitches, matching his pitch count from a week ago in his sixth career complete game. The right-hander also ran his unbeaten streak to 13 games, and he is 7-0 since his last loss on April 17 against the Miami Marlins. ",2018-08-01T08:54:18+0000,MLB roundup: Nationals score team-record 25
3,3,67,Reuters Staff,"Francisco Cervelli hit a two-run homer, and Gregory Polanco added a solo shot for the winning margin as Pittsburgh downed visiting Chicago. David Freese added two RBI doubles for the Pirates, who have won three of four games and 14 of 17. Javy Baez belted a three-run homer and finished a triple shy of hitting for the cycle for the Cubs, who have lost three of four. ",2018-08-01T08:54:18+0000,MLB roundup: Nationals score team-record 25
4,3,110,Reuters Staff,"Greg Allen had three hits and scored three runs, and Jose Ramirez had three hits and drove in two runs as Cleveland snapped a two-game losing streak with a win over Minnesota in Minneapolis. Edwin Encarnacion drove in three runs and Francisco Lindor had two hits and scored twice for Cleveland, which won for just the fourth time in 11 meetings with the Twins while improving to 31-15 against American League Central opponents. Trevor Bauer (10-6) allowed two runs on four hits but also walked four and hit a batter in 6 1/3 innings. He struck out three, snapping a streak of 12 consecutive starts with seven or more strikeouts. ",2018-08-01T08:54:18+0000,MLB roundup: Nationals score team-record 25
5,3,72,Reuters Staff,"Jake Arrieta pitched seven strong innings, and Roman Quinn led the offense with three hits as Philadelphia posted a victory at Boston. Maikel Franco had two hits, walked twice and scored two runs for the Phillies, who snapped a four-game losing streak. Carlos Santana added a pair of hits. Arrieta (9-6) allowed six hits and one run. He struck out seven, didn¡¯t walk a batter and threw 94 pitches, 66 for strikes. ",2018-08-01T08:54:18+0000,MLB roundup: Nationals score team-record 25
6,3,97,Reuters Staff,"Charlie Blackmon and Carlos Gonzalez homered to back the strong pitching of right-hander Jon Gray, helping Colorado turn back host St. Louis. Gray (9-7) went 7 1/3 innings, allowing three runs (two earned) and four hits. He walked two and struck out five. After Matt Carpenter hit Gray¡¯s fourth pitch of the first inning for a leadoff home run, the Rockies did all the scoring until the eighth, building a 6-1 lead in the process. Blackmon¡¯s homer, his 21st of the season, came with two outs in the third inning and gave Colorado the lead for good. ",2018-08-01T08:54:18+0000,MLB roundup: Nationals score team-record 25
7,3,124,Reuters Staff,"A.J. Pollock homered, Zack Godley tied a career high with 10 strikeouts, and Arizona regained first place in the National League West with a win over visiting Texas. Jon Jay had two singles and an RBI, and Nick Ahmed had a two-run double for the Diamondbacks, who have won seven of 10 and moved one-half game ahead of the Los Angeles Dodgers and the Colorado Rockies in the division. Godley (12-6) gave up two hits in seven innings, singles by Robinson Chirinos in the second inning and Willie Calhoun in the fifth, walked one and hit a batter. Godley struck out the first batter in each of his seven innings, the first in the majors to do that since 1974, according to STATS LLC. ",2018-08-01T08:54:18+0000,MLB roundup: Nationals score team-record 25
8,3,107,Reuters Staff,"Ronald Acuna Jr. homered for the second straight game, and left-hander Kolby Allard won his major league debut as host Atlanta beat Miami. Acuna led off the game with a home run, his 11th, to give Allard an early lead. The lefty wound up pitching five innings for the win, the third straight for the Braves. Allard gave up five runs (four earned). Acuna was 3-for-5 and drove in two runs to pace Atlanta¡¯s 19-hit attack. Acuna is seventh player in franchise history to hit double-digit home runs before turning 21. Five other Braves had multi-hit games, with Ender Inciarte getting four and Freddie Freeman collecting three. ",2018-08-01T08:54:18+0000,MLB roundup: Nationals score team-record 25
9,3,109,Reuters Staff,"Ryan O¡¯Hearn made his major league debut a memorable one, when his first career hit, a two-run homer, snapped a scoreless tie and lifted visiting Kansas City past Chicago. The Royals have won six of their past 11. The White Sox have lost five of six. O¡¯Hearn, 25, was recalled from Triple-A Omaha earlier in the day after playing 558 minor league games, and he is expected to see regular playing time down the stretch for the rebuilding Royals. Starting as the designated hitter, he grounded out in his first at-bat in the third inning before homering to right in the fifth to score Jorge Bonifacio, who had walked. ",2018-08-01T08:54:18+0000,MLB roundup: Nationals score team-record 25
10,3,129,Reuters Staff,"Tampa Bay scored seven runs in the fourth inning and coasted to a win over Los Angeles in St. Petersburg, Fla. The Rays got six hits, two walks and a hit batter in the decisive inning, Michael Perez¡¯s double the only extra-base hit in the frame. All but two singles in the inning came against Angels starter Tyler Skaggs (8-7), who was charged with 10 runs on eight hits and three walks in 3 1/3 innings, by far his worst performance of the season. In all, the Rays had 14 hits, including three each from Mallex Smith and Matt Duffy, two from Carlos Gomez, and a home run from Jake Bauers. Everyone in Tampa Bay¡¯s starting lineup had at least one hit by the end of the sixth inning. ",2018-08-01T08:54:18+0000,MLB roundup: Nationals score team-record 25
11,3,90,Reuters Staff,"Matthew Boyd outdueled Homer Bailey, and Niko Goodrum hit a solo homer to lead host Detroit past Cincinnati. Boyd (6-9) held the Reds to four hits and a walk in eight scoreless innings while striking out seven. Shane Greene recorded his 22nd save despite giving up a run in the ninth. Goodrum broke a scoreless deadlock with a fourth-inning homer. Detroit¡¯s Mike Gerber, who was called up from Triple-A Toledo earlier in the day, supplied a run-scoring double in the eighth inning for his first major league hit and RBI. ",2018-08-01T08:54:18+0000,MLB roundup: Nationals score team-record 25
12,3,91,Reuters Staff,"Khris Davis smacked his 29th home run among three hits, powering Oakland past visiting Toronto. Trevor Cahill (3-2) limited the Blue Jays to two runs over six innings, and the Oakland bullpen cleaned up with three innings of one-hit relief, helping the A¡¯s open an eight-game homestand with a second straight win. The Blue Jays scored in the top of the first against Cahill on an RBI single by Kendrys Morales before Davis contributed a single to a two-run bottom of the first that gave the A¡¯s the lead for good. ",2018-08-01T08:54:18+0000,MLB roundup: Nationals score team-record 25
13,3,92,Reuters Staff,"Charlie Morton pitched six strong innings, and Evan Gattis hit a tiebreaking home run as Houston snapped a season-worst, five-game losing streak with a win at Seattle. Houston¡¯s Josh Reddick, who went 3-for-5 with three RBIs, added a two-run homer in the top of the ninth off left-hander Zach Duke, who was making his Mariners debut after being acquired in a trade with the Minnesota Twins. Morton (12-2) allowed two runs on six hits. He walked one and struck out eight. Hector Rondon pitched a perfect ninth inning for his 10th save. ",2018-08-01T08:54:18+0000,MLB roundup: Nationals score team-record 25
14,3,78,Reuters Staff,"Brandon Crawford singled home Evan Longoria with two outs in the 10th inning to give visiting San Francisco a second straight extra-innings victory over San Diego. San Francisco, which arrived in San Diego having gone 3-6 since the All-Star break, won its third straight. The loss was San Diego¡¯s seventh straight, and the Padres have dropped 14 of their past 16 games. They went 5-20 in July, the second-worst month in the franchise¡¯s 50-year history by winning percentage. ",2018-08-01T08:54:18+0000,MLB roundup: Nationals score team-record 25
15,4,129,Reuters Staff,"Atlanta left-hander Sean Newcomb came within one out of a no-hitter, and the Braves posted a 4-1 win over the visiting Los Angeles Dodgers on Sunday. After taking a close 1-2 pitch for a ball, Los Angeles¡¯ Chris Taylor ended the no-hit bid with a clean single to left field with two outs in the ninth inning. Newcomb, who threw 134 pitches, was immediately replaced by Dan Winkler. The reliever allowed Taylor to take second on indifference and permitted an RBI single to Manny Machado to end the shutout. Newcomb (10-5) struck out eight and issued one walk, to Yasiel Puig to start the sixth inning. There were no other close calls, although center fielder Ender Inciarte made a nice running catch on a fly ball by Enrique Hernandez. ",2018-07-30T06:17:24+0000,MLB roundup: Braves' Newcomb just misses no-hitter
16,3,93,Reuters Staff,"Ronald Guzman recorded the last of three sixth-inning doubles, and Texas rode a strong pitching performance from Mike Minor to a victory and a three-game series sweep at Houston. The Astros dropped their fourth consecutive game and endured their first series sweep on the season. Houston claimed the season series from Texas 12-7 but entered the weekend having won eight consecutive games against the Rangers. Minor (7-6) recorded eight strikeouts, one shy of his season high, over six innings, issuing just one walk, which was intentional, while allowing two runs and four hits. ",2018-07-30T06:17:24+0000,MLB roundup: Braves' Newcomb just misses no-hitter
17,3,79,Reuters Staff,"Tom Murphy homered, German Marquez pitched into the eighth inning, and Colorado beat Oakland to sweep the three-game series in Denver. Ryan McMahon, Trevor Story and Charlie Blackmon each had two hits for Colorado, and Wade Davis pitched the ninth for his 30th save. The Rockies have won four straight and 11 of their past 13. Matt Chapman and Khris Davis homered for Oakland, which came into the weekend on a six-game winning streak but couldn¡¯t solve Colorado¡¯s pitching. ",2018-07-30T06:17:24+0000,MLB roundup: Braves' Newcomb just misses no-hitter
18,3,80,Reuters Staff,"Arizona scored all of its runs on homers by Paul Goldschmidt, A.J. Pollock and Nick Ahmed off Padres rookie starter Joey Lucchesi, then held on to complete a three-game sweep in San Diego. Clay Buchholz (4-1) limited the Padres to three runs over 5 2/3 innings. Brad Boxberger pitched a scoreless ninth to pick up his 25th save. Ahmed finished with three hits for the Diamondbacks. The Padres lost their fifth straight and are 2-12 over their past 14 games. ",2018-07-30T06:17:24+0000,MLB roundup: Braves' Newcomb just misses no-hitter
19,3,110,Reuters Staff,"Nathan Eovaldi pitched seven shutout innings in his Boston debut, and J.D. Martinez had two hits and drove in three runs in a win over visiting Minnesota. It was the third straight victory for Boston (74-33), which moved 41 games over .500 for first time since Sept. 27, 1946. The Red Sox also improved to 37-14 at Fenway Park, where they have won 13 of their last 15 games. Eovaldi (4-4), acquired in a trade with Tampa Bay on Wednesday, allowed just four hits and didn¡¯t walk a batter while striking out five. It marked the eighth time in 11 games that the Boston starting pitcher didn¡¯t allow a run. ",2018-07-30T06:17:24+0000,MLB roundup: Braves' Newcomb just misses no-hitter
20,3,104,Reuters Staff,"J.A. Happ pitched six outstanding innings in his debut for New York to earn a win over visiting Kansas City. Happ (11-6) allowed one run on three hits after getting traded in the days leading up to the non-waiver deadline for the fourth time in his career. The veteran left-hander also won for the first time since June 25 after going 0-3 in his last four starts for the Toronto Blue Jays. Aaron Hicks hit a two-run homer, fell a triple shy of the cycle and reached base four times for the Yankees. Salvador Perez, Hunter Dozier and Rosell Herrera homered for the Royals. ",2018-07-30T06:17:24+0000,MLB roundup: Braves' Newcomb just misses no-hitter
21,3,96,Reuters Staff,"Chris Davis hit two of Baltimore¡¯s four home runs and drove in four as the host Orioles defeated Tampa Bay. The Orioles won the last three games in the four-game series thanks to their long-dormant offense, which scored a total of 37 runs in the three contests, registering at least 11 runs each day. Davis hit a pair of two-run shots. Jonathan Schoop homered for the sixth time in seven games, a three-run blast. Austin Wynns added a solo homer and three runs. The Rays got two homers from C.J. Cron and one from Jake Bauers. ",2018-07-30T06:17:24+0000,MLB roundup: Braves' Newcomb just misses no-hitter
22,3,90,Reuters Staff,"Kyle Hendricks pitched seven strong innings as Chicago won at St. Louis. Ben Zobrist and Anthony Rizzo hit home runs for the Cubs, who avoided a three-game sweep. Hendricks (7-9) allowed two runs on four hits. He didn¡¯t walk a batter and matched a season high with eight strikeouts. It was only the second time in six July starts that he went more than five innings. Carl Edwards Jr. pitched a scoreless eighth for the Cubs, and Pedro Strop worked a 1-2-3 ninth for his fifth save of the season. ",2018-07-30T06:17:24+0000,MLB roundup: Braves' Newcomb just misses no-hitter
23,3,99,Reuters Staff,"Corey Kluber bounced back from two subpar outings, Cleveland batters backed him with three homers, and the visiting Indians cruised past Detroit. Kluber (13-6) gave up one run on five hits and a walk in 7 1/3 innings while striking out five. The Indians ace surrendered nine earned runs and three homers while losing his previous two starts. Yonder Alonso had three hits, including a homer, and drove in three runs. Edwin Encarnacion contributed a solo shot among two hits and drove in two runs, and Melky Cabrera supplied three hits, including his first long ball of the season. ",2018-07-30T06:17:24+0000,MLB roundup: Braves' Newcomb just misses no-hitter
24,3,84,Reuters Staff,"Jose Urena snapped an eight-game home losing streak and added an RBI single as Miami defeated Washington. Urena (3-10) won his first game at Marlins Park since beating the New York Mets on Sept. 20, 2017. He held the Nationals scoreless for six innings, giving up one hit and four walks while striking out five. He combined with Adam Conley, Brad Ziegler and Drew Steckenrider on a two-hitter. Martin Prado smacked a pair of RBI hits to help the Marlins split the four-game series. ",2018-07-30T06:17:24+0000,MLB roundup: Braves' Newcomb just misses no-hitter
25,3,80,Reuters Staff,"Luis Castillo pitched seven shutout innings, Scooter Gennett belted a two-run home run, and Cincinnati earned a series victory over visiting Philadelphia. Castillo (6-8) teamed with David Hernandez, Wandy Peralta and Raisel Iglesias on the Reds¡¯ third shutout of the season. Cincinnati earned three straight wins after the first-place Phillies had won the opener of the four-game series. Gennett hit his 17th homer, and a two-run shot to cap a three-run third inning. Iglesias was credited with his 21st save. ",2018-07-30T06:17:24+0000,MLB roundup: Braves' Newcomb just misses no-hitter
26,3,79,Reuters Staff,"Zack Wheeler pitched six shutout innings and hit a two-out RBI double, leading New York to a win at Pittsburgh. Seth Lugo allowed one hit in two innings, and Anthony Swarzak pitched a perfect ninth for his third save to complete the six-hit shutout. Austin Jackson was 2-for-3 with a walk for the Mets, who ended a two-game losing streak and earned a split in the four-game series. Gregory Polanco was 3-for-4 with two stolen bases for the Pirates. ",2018-07-30T06:17:24+0000,MLB roundup: Braves' Newcomb just misses no-hitter
27,3,139,Reuters Staff,"Teoscar Hernandez hit the game-tying homer, and Brandon Drury had the go-ahead two-run double as Toronto scored five runs in the ninth inning to win at Chicago. Jace Fry (0-2) allowed Hernandez¡¯s 16th homer to lead off the ninth, tying the game at 3. Kendrys Morales was hit by a pitch and took third on a double by Aledmys Diaz, who hit a solo homer earlier in the game. Jeanmar Gomez replaced Fry and allowed the two-run double by Drury, who took third on a groundout. Luke Maile followed with an RBI double, and Lourdes Gurriel Jr. later added a run-scoring single. Gurriel was helped off the field with a leg injury after being thrown at second base on the play to end the inning. Gurriel was 3-for-5 with two RBIs to record his club-record 11th straight multi-hit game. ",2018-07-30T06:17:24+0000,MLB roundup: Braves' Newcomb just misses no-hitter
28,3,71,Reuters Staff,"Buster Posey collected four hits, including a bases-clearing double in a four-run third inning, sending San Francisco past visiting Milwaukee. Pablo Sandoval laced a two-run triple and Gorkys Hernandez homered for the Giants, who prevented a four-game sweep by the Brewers and ended a four-game losing streak in the process. Ryan Braun, Hernan Perez and Travis Shaw homered for the Brewers, who lost for just the second time in six games. ",2018-07-30T06:17:24+0000,MLB roundup: Braves' Newcomb just misses no-hitter
29,3,112,Reuters Staff,"Seattle erupted for seven runs in the first inning and held on for a win over Los Angeles at Anaheim, Calif., avoiding a three-game sweep. Angels starter Felix Pena got only one out and was charged with all seven runs in the opening frame. The Mariners finished with 14 hits in all, including three each from Dee Gordon, Ben Gamel and Denard Span. Mike Zunino chipped in with two hits and three RBIs. Seattle starter Marco Gonzales (12-5) gave up two runs on seven hits and two walks in six innings, striking out seven. The only runs he gave up came on a two-run homer by Justin Upton in the fifth inning. ",2018-07-30T06:17:24+0000,MLB roundup: Braves' Newcomb just misses no-hitter
30,4,162,Reuters Staff,"Ryan McMahon hit a three-run home run with two outs in the bottom of the ninth, and the Colorado Rockies rallied to beat the Los Angeles Dodgers 3-2 in Denver on Saturday night. It was the second straight night McMahon hit a game-winning home run against L.A. His two-run homer in the seventh inning Friday night gave the Rockies a 5-4 win. Trevor Story started the rally with a one-out double off Scott Alexander. JT Chargois came on to face pinch hitter Nolan Arenado, who didn¡¯t start because of a sore right shoulder that forced him out of Friday¡¯s game. Chargois (2-4) hit Arenado to put runners on first and second, and then got Ian Desmond on a force play that put runners on the corners. McMahon hit a 1-0 fastball over the fence in right-center field to give the Rockies the win and deny the Dodgers an opportunity to move into sole possession of first place in the National League West. ",2018-08-12T09:38:47+0000,MLB roundup: Rockies stun Dodgers on McMahon HR
31,3,87,Reuters Staff,"Pinch hitter Tucker Barnhart hit a two-run, go-ahead double in a four-run eighth inning to lead Cincinnati past visiting Arizona. Barnhart hit a two-out double on a 3-2 pitch from Archie Bradley (3-4), and Billy Hamilton and Joey Votto added RBIs singles off reliever T.J. McFarland as the Reds improved to 14-5 in their last six series against division leaders. David Peralta and Eduardo Escobar homered for the Diamondbacks, who have lost three of four. The game was delayed 40 minutes at the start because of rain. ",2018-08-12T09:38:47+0000,MLB roundup: Rockies stun Dodgers on McMahon HR
32,11,311,Reuters Staff,"Rookie Miguel Andujar hit a tiebreaking two-run homer in the bottom of the seventh inning, Aroldis Chapman escaped a bases-loaded jam in the top of the ninth and New York held off Texas at Yankee Stadium. Andujar broke a 3-3 deadlock when he lined a first-pitch 94 mph fastball from Chris Martin (1-3) into the right-center-field seats. It was Andujar¡¯s 17th homer ¡ª fifth since the All-Star break ¡ª and 50th extra-base hit, the most among all first-year players. Before the eventful seventh, the Yankees took a 3-1 lead on Giancarlo Stanton¡¯s fourth homer in five games in the first inning, combined with an RBI double by Greg Bird in the first and a run-scoring single by Neil Walker in the sixth. Red Sox 5, Orioles 0 (Game 1) Jackie Bradley Jr. homered twice and Eduardo Nunez added one more while starter David Price struck out 10 in six innings as Boston defeated host Baltimore in the opener of a day-night doubleheader. Price (12-6) always has been dominant at Camden Yards and turned in another solid performance in this win. The left-hander scattered five hits in those six shutout innings and didn¡¯t surrender a walk. The victory improved Price to 8-0 in his career at Baltimore. His 10 strikeouts were a season high and the most he¡¯s had in a game since July 10, 2016. Red Sox 6, Orioles 4 (Game 2) J.D. Martinez homered twice, and the second one was a two-run tiebreaking shot that gave Boston a sweep of the doubleheader at Baltimore. Martinez hit a solo homer earlier in the game, but his big hit came off Mike Wright Jr. (3-1) in the eighth. The two-run shot to left-center snapped a 3-3 tie. Martinez finished 2-for-2 with two walks, two runs and three RBIs. He now has 37 homers and 104 RBIs, leading the majors in both categories. ",2018-08-12T09:38:47+0000,MLB roundup: Rockies stun Dodgers on McMahon HR
33,3,80,Reuters Staff,"Ryan Zimmerman bombed Jon Lester for the 21st multi-homer game of his career, powering visiting Washington past Chicago. Zimmerman connected on a two-run shot in the first inning and a three-run homer in the fourth, mixing in a sacrifice fly in the third inning for a career-high-tying six RBIs. Lester (12-5) was torched for nine runs (eight earned) in just 3 2/3 innings. He allowed 10 hits and one walk, striking out five, in his worst start of the season. ",2018-08-12T09:38:47+0000,MLB roundup: Rockies stun Dodgers on McMahon HR
34,3,106,Reuters Staff,"Wade LeBlanc rebounded well from his previous start against Houston, and visiting Seattle turned a two-out ambush in the fourth inning into a third straight win. The Mariners evened the season series with the Astros at 6-6 and will go for the sweep of the four-game weekend series on Sunday. The Astros have dropped seven consecutive games at Minute Maid Park, spanning three series. LeBlanc continued what has been a solid showing by Seattle starters, allowing two runs on three hits and two walks with five strikeouts over five innings. Mariners closer Edwin Diaz recorded his 45th save with a perfect ninth inning, including two strikeouts. ",2018-08-12T09:38:47+0000,MLB roundup: Rockies stun Dodgers on McMahon HR
35,3,109,Reuters Staff,"Edwin Jackson took a shutout into the eighth inning, and Marcus Semien blasted two home runs to lead Oakland to victory at Los Angeles. Jackson held the Angels scoreless on two hits through seven innings, but Los Angeles put a couple runners on base in the eighth, ending his night. The A¡¯s bullpen bailed him out of the inning, and Jackson (4-2) wound up throwing 7 1/3 scoreless frames, allowing three hits and three walks while striking out six. Semien led the A¡¯s 14-hit attack with the two homers and a double, while Stephen Piscotty had three hits and Khris Davis hit his 34th home run of the season. ",2018-08-12T09:38:47+0000,MLB roundup: Rockies stun Dodgers on McMahon HR
36,3,96,Reuters Staff,"Josh Bell hit the only home run on Barry Bonds jersey retirement night in San Francisco, a three-run shot in the fourth inning that propelled Pittsburgh to victory. Trevor Williams (10-8) continued his brilliant pitching with seven innings of five-hit ball, helping the Pirates clinch the season series over the Giants with a fourth win in six games. The Giants retired Bonds¡¯ No. 25 prior to the game with a ceremony that included appearances from Willie Mays, Willie McCovey and Dusty Baker. The ceremony included in-stadium speeches and video tributes to the all-time home run king. ",2018-08-12T09:38:47+0000,MLB roundup: Rockies stun Dodgers on McMahon HR
