,#para,#word,author,content,time,title
297,3,111,Reuters Staff,"Hanley Ramirez hit a two-run homer, David Price pitched into the sixth inning and visiting Boston defeated Toronto. Price (3-4) allowed two runs, five hits and three walks and struck out six in 5 1/3 innings for his first win since April 17, a span of three winless starts. Price had missed his scheduled start on Wednesday with a mild case of carpal tunnel syndrome. Toronto¡¯s Marco Estrada (2-3) allowed four runs, seven hits and one walk while striking out five in six innings in his fourth straight start without a win. Justin Smoak homered for the Blue Jays, who won the opener of the three-game series in 12 innings Friday. ",2018-05-13T10:16:32+0000,MLB roundup: Yankees rally to beat A's in extras
298,3,103,Reuters Staff,"Jordy Mercer got hit by a Tony Watson pitch with the based loaded in the eighth inning to give Pittsburgh its fifth straight win by beating visiting San Francisco. Pirates starter Chad Kuhl gave up three runs and six hits in six innings, with six strikeouts and four walks. Gregory Polanco and Francisco Cervelli homered for Pittsburgh. San Francisco has lost a season-worst six straight. Giants starter Jeff Samardzija had his longest outing of the season, allowing five runs and six hits in 5 2/3 innings, with five strikeouts and two walks. Evan Longoria and Alen Hanson hit home runs for San Francisco. ",2018-05-13T10:16:32+0000,MLB roundup: Yankees rally to beat A's in extras
299,3,162,Reuters Staff,"Scott Schebler hit a go-ahead three-run home run in the sixth inning as Cincinnati pushed its win streak to five games and clinched its first series win at Dodger Stadium in seven tries going back to 2011 with a victory in Los Angeles. Reds starter Homer Bailey (1-5) dodged trouble all night, giving up three runs on 10 hits over five innings. Scooter Gennett had three hits, but his run of consecutive games with a home run ended at four, one shy of tying a franchise record. Dodgers starter Ross Stripling gave up two runs on six hits over 5 1/3 innings, with a career-high seven strikeouts. With Stripling at 79 pitches in the sixth, the Dodgers replaced the spot starter with JT Chargois (1-1), who gave up three runs on four hits while recording just one out. Cody Bellinger hit a solo home run for the Dodgers in the third inning, his fifth of the season and first since May 1. ",2018-05-13T10:16:32+0000,MLB roundup: Yankees rally to beat A's in extras
300,3,102,Reuters Staff,"Trevor Story drove in four runs with two home runs and a double, and five pitchers combined on a five-hit shutout, delivering Colorado a victory over Milwaukee in Denver. Kyle Freeland pitched into the seventh inning, and relievers Bryan Shaw, Mike Dunn, Adam Ottavino and Wade Davis limited the Brewers to one hit over the final 2 2/3 innings, helping the Rockies snap a three-game losing streak. The shutout was the fifth of the season for the Colorado pitching staff. The Rockies had allowed 24 runs in their previous three games. The Brewers were shut out for the eighth time this season. ",2018-05-13T10:16:32+0000,MLB roundup: Yankees rally to beat A's in extras
301,3,89,Reuters Staff,"Eric Hosmer doubled home pinch runner Jordan Lyles from second with no one out in the bottom of the 13th inning to give San Diego a walk-off victory over St. Louis at Petco Park. The game-winning double into the right field corner ¡ª on the first pitch from Cardinals reliever Mike Mayers ¡ª was the ninth walk-off hit of Hosmer¡¯s career. A.J. Ellis and Travis Jankowski drew back-to-back walks to open the 13th from reliever John Brebbia (0-1), who was then replaced by Mayers as the eighth Cardinals pitcher. ",2018-05-13T10:16:32+0000,MLB roundup: Yankees rally to beat A's in extras
302,3,112,Reuters Staff,"Mitch Garver¡¯s RBI double in the top of the 12th inning snapped a 3-3 tie and helped lift Minnesota to victory over host Los Angeles. Garver¡¯s game-winner, off Angels right-hander Noe Ramirez, ended a battle of bullpens that saw relievers from both teams put up zeroes after the seventh inning and into the 12th. Ramirez (1-2), the last of four Angels relievers, had pitched two scoreless innings before being sent out for the 12th. But Eddie Rosario led off with an infield single and then scored on Garver¡¯s double. One out later, Garver scored on a single by Gregorio Petit, who played for the Angels two seasons ago, to make it 5-3. ",2018-05-13T10:16:32+0000,MLB roundup: Yankees rally to beat A's in extras
303,3,88,Reuters Staff,"Grayson Greiner knocked in the first two runs of his career, Jose Iglesias hit a two-run homer and Detroit held off Seattle in the first game of a doubleheader. Greiner, a rookie catcher, had two run-scoring hits while Iglesias ripped his second homer this season. JaCoby Jones added two hits and a run scored. Detroit¡¯s Matthew Boyd (2-3) allowed three runs on three hits with six strikeouts in six-plus innings to collect the win. Seattle starter Marco Gonzales (3-3) allowed four runs on 10 hits in six innings. ",2018-05-13T10:16:32+0000,MLB roundup: Yankees rally to beat A's in extras
304,3,109,Reuters Staff,"Robinson Cano hit a three-run homer, Ryon Healy drove in three runs and Seattle salvaged a split of a doubleheader in beating Detroit. Cano hit his fourth homer and also scored two runs, while Healy blasted his seventh homer and added an RBI double for the Mariners. Kyle Seager had three hits, scored two runs and knocked in two more, while Nelson Cruz supplied three hits, a run scored and an RBI. John Hicks led the Detroit attack with three hits, including a two-run homer. Pete Kozma had two hits, a run scored and two RBIs, while JaCoby Jones scored two runs, including a first-to-home scamper on a single. ",2018-05-13T10:16:32+0000,MLB roundup: Yankees rally to beat A's in extras
305,3,136,Reuters Staff,"Jonathan Schoop homered twice to help starter David Hess win in his major league debut as Baltimore won its fourth straight and defeated Tampa Bay in the first game of a doubleheader at Oriole Park. Hess was the 26th man on the Orioles¡¯ roster (which is allowed for doubleheaders), and after starting poorly, rebounded strongly. The right-hander gave up three runs on four hits in the first inning and then retired 18 of the final 20 batters he faced. Overall, Hess (1-0) allowed three runs on six hits in six innings. He struck out three without a walk and threw just 78 pitches. Tampa Baydropped its fifth in a row. Rays starter Chris Archer (2-3) gave up all six runs Baltimore scored in seven innings. He allowed seven hits and couldn¡¯t hold the early 3-0 lead. ",2018-05-13T10:16:32+0000,MLB roundup: Yankees rally to beat A's in extras
306,3,112,Reuters Staff,"C.J. Cron and Brad Miller both homered, and Tampa Bay defeated Baltimore to earn a split of the doubleheader at Camden Yards. The Rays¡¯ victory also snapped their five-game losing skid while Baltimore had won four in a row. There was a 1-hour, 19-minute rain delay in the sixth inning. The Rays pitched by committee in this game as seven pitchers combined to allow just three runs and four hits, with Sergio Romo (1-0) earning the win by throwing 1 1/3 shutout innings. Baltimore starter Alex Cobb (0-5) lost for the second time this season to his former team. He allowed four runs (three earned) on seven hits in 5 2/3 innings. ",2018-05-13T10:16:32+0000,MLB roundup: Yankees rally to beat A's in extras
307,1,45,Reuters Staff,The contest between host Philadelphia and New York at Citizens Bank Park was postponed following a roughly one-hour rain delay from the scheduled start time. The game will be made up on Aug. 16 as part of a single-admission doubleheader beginning at 4:05 p.m. ET. ,2018-05-13T10:16:32+0000,MLB roundup: Yankees rally to beat A's in extras
308,4,159,Reuters Staff,"On a night dominated by seven no-hit innings from St. Louis right-hander Daniel Poncedeleon in his major league debut, the Cincinnati Reds rallied with two outs in the bottom of the ninth to upend the visiting Cardinals 2-1 on Monday.  The Reds entered the ninth inning with only one hit, an eighth-inning single off reliever Jordan Hicks, and Cardinals closer Bud Norris retired the first two batters in the ninth. Eugenio Suarez then hit a 1-0 fastball for a home run, and two singles and a walk later, pinch hitter Dilson Herrera smacked the first pitch he saw from Norris (3-3) for a game-winning single to center. The first seven innings belonged to Poncedeleon, who allowed only three walks while striking out three. He left after seven innings, having thrown 116 pitches, 75 for strikes. In May 2017, Poncedeleon needed emergency brain surgery after he was struck by a line drive in the right temple while pitching in Triple-A. ",2018-07-24T09:59:53+0000,MLB roundup: Cards fall despite Poncedeleon's stellar debut
309,3,107,Reuters Staff,"Freddie Freeman slugged a two-run homer, Dansby Swanson blasted a solo shot, and Charlie Culbertson had a career-high four hits as Atlanta won at Miami. Culbertson went 4-for-6 with two doubles and three RBIs for the Braves, who stroked 16 hits, including eight for extra bases. Freeman¡¯s opposite-field blast was his fifth homer in eight games against the Marlins this season. Sean Newcomb (9-5) overcame four walks to earn his first win since June 6, ending a five-game drought. He had entered Monday 0-3 with a 9.75 ERA this month, but he limited the Marlins to four hits and one run in six innings, striking out five. ",2018-07-24T09:59:53+0000,MLB roundup: Cards fall despite Poncedeleon's stellar debut
310,3,110,Reuters Staff,"Josh Harrison finished 2-for-3 with a three-run home run, and Pittsburgh increased its winning streak to 10 games with a rain-shortened victory at Cleveland. The game was called in the top of the seventh inning after the third rain delay of the night. The start of the game was delayed an hour by inclement weather, and more rain prompted a second delay in the bottom of the third. Starling Marte and Gregory Polanco had two RBIs apiece for the Pirates, who have not dropped a game since July 10 and have a double-digit winning streak for the first time since 2004. Trevor Williams pitched an abbreviated shutout, allowing four hits. ",2018-07-24T09:59:53+0000,MLB roundup: Cards fall despite Poncedeleon's stellar debut
311,3,105,Reuters Staff,"Max Muncy, Yasmani Grandal, Chris Taylor and Joc Pederson homered, and Los Angeles won at Philadelphia. A ninth-inning wild pitch by Seranthony Dominguez (1-3) with the bases loaded scored Alex Verdugo to give the Dodgers a 6-5 lead. After Dominguez was replaced by Luis Garcia, Matt Kemp added a run-scoring single for a 7-5 advantage. Maikel Franco led off the bottom of the ninth with a solo homer, his second of the game and 15th of the season, but Kenley Jansen retired the next three batters for his 29th save. Rhys Hoskins and Odubel Herrera also homered for the Phillies, and Franco had three hits. ",2018-07-24T09:59:53+0000,MLB roundup: Cards fall despite Poncedeleon's stellar debut
312,3,80,Reuters Staff,"Jonathan Lucroy¡¯s fourth career grand slam ignited an 18-hit assault on Cole Hamels and four Texas relievers, and surging Oakland rolled in Arlington, Texas. Stephen Piscotty, Matt Chapman and Khris Davis also homered for the A¡¯s, who won for the 24th time in their past 31 games. Brett Anderson (2-2) benefited from Oakland¡¯s third-largest run total of the season, coasting through six innings for the win. He allowed two runs and six hits while striking out six and walking one. ",2018-07-24T09:59:53+0000,MLB roundup: Cards fall despite Poncedeleon's stellar debut
313,3,69,Reuters Staff,"Mitch Moreland homered, Andrew Benintendi hit a two-run double, and Rick Porcello threw six shutout innings as Boston won at Baltimore. Porcello (12-4) scattered six hits and a walk while striking out six. Craig Kimbrel closed it in the ninth and earned his 32nd save despite giving up a run. The Red Sox now have a 10-1 record against the Orioles this season. Baltimore dropped its fourth consecutive game. ",2018-07-24T09:59:53+0000,MLB roundup: Cards fall despite Poncedeleon's stellar debut
314,3,64,Reuters Staff,"Patrick Corbin pitched seven strong innings, and Paul Goldschmidt hit a home run as Arizona won at Chicago. Corbin (7-4) allowed one run on six hits. He didn¡¯t walk a batter and struck out nine while winning for the first time in eight starts. Jeff Mathis¡¯ two-run double capped the Diamondbacks¡¯ five-run first inning, and Goldschmidt¡¯s solo shot in the second made it 6-0. ",2018-07-24T09:59:53+0000,MLB roundup: Cards fall despite Poncedeleon's stellar debut
315,3,119,Reuters Staff,"Freddy Galvis and Manuel Margot had RBI hits in consecutive at-bats, and San Diego took advantage of shoddy fielding by the Mets to defeat host New York and ace Jacob deGrom. DeGrom (5-5) allowed just one hit while facing the minimum through the first four innings and was nursing a 1-0 lead before the Mets¡¯ defense began letting him down in the fifth. Right fielder Jose Bautista dropped a routine one-out fly by Christian Villanueva, who stole second and scored the game-tying run on Galvis¡¯ single. Margot followed with a triple to deep center field. Joey Lucchesi (5-5) earned the win after allowing two runs on six hits and no walks while striking out six over 5 1/3 innings. ",2018-07-24T09:59:53+0000,MLB roundup: Cards fall despite Poncedeleon's stellar debut
316,3,82,Reuters Staff,"Logan Morrison hit a home run and had three RBIs, Max Kepler added a two-run blast, Adalberto Mejia pitched into the sixth inning, and Minnesota won at Toronto. Mejia (1-0), recalled from Triple-A Rochester to make the start, allowed one run, eight hits and two walks while striking out three in 5 1/3 innings. The Twins ended a three-game losing streak while stopping the Blue Jays¡¯ string of three straight wins. Lourdes Gurriel Jr. hit a solo homer for the Blue Jays. ",2018-07-24T09:59:53+0000,MLB roundup: Cards fall despite Poncedeleon's stellar debut
317,3,102,Reuters Staff,"Jake Bauers had two hits, including a three-run homer, as Tampa Bay pounded New York ace Luis Severino and held on for a win at St. Petersburg, Fla. The Yankees loaded the bases with one out in the top of the ninth before Tampa Bay reliever Jose Alvarado enticed Aaron Hicks and Gary Sanchez into groundouts to earn his fourth save of the year. Rays rookie Hunter Wood started and went two innings before leaving for Matt Andriese (3-4), who threw the next 3 2/3 innings to earn the win. Severino allowed seven runs (six earned) on 11 hits in five-plus innings. ",2018-07-24T09:59:53+0000,MLB roundup: Cards fall despite Poncedeleon's stellar debut
318,3,86,Reuters Staff,"Jhoulys Chacin struck out a season-best nine in 5 2/3 innings and also contributed an RBI single as Milwaukee recorded a victory over visiting Washington. Christian Yelich delivered a three-run triple and Erik Kratz drove in two runs for the Brewers, who won for just the second time in 10 games. Chacin (9-3) gave up one run and two hits and didn¡¯t walk a batter while winning his third consecutive decision. Daniel Murphy homered for the Nationals, who have dropped four of their past six games. ",2018-07-24T09:59:53+0000,MLB roundup: Cards fall despite Poncedeleon's stellar debut
319,3,104,Reuters Staff,"James McCann drove in two runs, including a go-ahead double during a three-run ninth, and Detroit rallied for a victory at Kansas City. Jim Adduci supplied a two-run double, and Jose Iglesias knocked in the other run for Detroit. Alex Wilson tossed 1 1/3 innings of scoreless relief to pick up the win. Shane Greene got the last three outs for his 20th save. The Tigers¡¯ rally denied Royals rookie Heath Fillmyer his first major league victory. Fillmyer gave up two runs (one earned) on three hits and struck out six in 6 2/3 innings. Lucas Duda drove in three runs for the Royals. ",2018-07-24T09:59:53+0000,MLB roundup: Cards fall despite Poncedeleon's stellar debut
320,3,110,Reuters Staff,"Jose Abreu hit a home run and a run-scoring single to back the solid pitching of Lucas Giolito as Chicago defeated Los Angeles in Anaheim, Calif. The win was the fifth in eight games for the White Sox. The Angels have lost four of their past five games and haven¡¯t won two straight since July 8-10. Giolito (7-8), the first of seven Chicago pitchers, gave up three runs on five hits and four walks over six innings. Joakim Soria allowed a bloop single and a walk in the ninth inning but struck out Justin Upton with two outs to escape the jam and record his 15th save of the year. ",2018-07-24T09:59:53+0000,MLB roundup: Cards fall despite Poncedeleon's stellar debut
321,4,181,Reuters Staff,"Jackie Bradley Jr. scored the tying run on a throwing error by third baseman Miguel Andujar with two outs in the ninth inning, and Andrew Benintendi hit a game-winning single with two outs in the 10th as the Boston Red Sox beat the New York Yankees 5-4 Sunday night, completing a four-game sweep at Fenway Park. Yankees closer Aroldis Chapman blew his first save chance since May 4, ending a streak of 22 straight converted. He allowed three walks and J.D. Martinez¡¯s two-out, two-run, bases-loaded single over second baseman Gleyber Torres¡¯ leaping attempt, cutting New York¡¯s lead to 4-3. It appeared the Yankees were going to hold on for the win, but Andujar did not set himself and bounced the throw to first baseman Greg Bird on a ground ball by Xander Bogaerts, and Bradley scored from second. In the 10th, Sandy Leon singled off Jonathan Holder (1-3) and took second on a wild pitch. The Yankees then intentionally walked Mookie Betts. Benintendi capped the four-hour, 39-minute marathon by chopping a single up the middle as pinch runner Tony Renda scored. ",2018-08-06T06:10:54+0000,"MLB roundup: Red Sox, Phillies cap 4-game sweeps"
322,3,108,Reuters Staff,"Asdrubal Cabrera hit a two-run homer in the bottom of the eighth inning, and Philadelphia defeated Miami to complete a four-game sweep. The Marlins had tied the game in the seventh on a two-run homer by Derek Dietrich and a solo shot by Justin Bour two outs later. After Pat Neshek (1-0) was perfect in the top of the eighth for Philadelphia, Nick Williams led off the bottom of the eighth with a single against Drew Steckenrider (3-2). One out later, Cabrera hit his 20th homer, and second since the Phillies acquired him from the New York Mets on July 27, to give Philadelphia the lead for good. ",2018-08-06T06:10:54+0000,"MLB roundup: Red Sox, Phillies cap 4-game sweeps"
323,3,110,Reuters Staff,"Manny Machado had three hits, and Brian Dozier delivered a two-run double as Los Angeles earned a victory to salvage a game against visiting Houston in a weekend World Series rematch. Walker Buehler (5-4) gave up two runs on four hits over 5 1/3 innings as the Dodgers won after scoring just one run and collecting seven hits combined in the first two games of the series. George Springer led off the game for the Astros with a home run, his 19th long ball of the year. Springer left the game in the third inning with left thumb discomfort after he was thrown out while trying to steal second base. ",2018-08-06T06:10:54+0000,"MLB roundup: Red Sox, Phillies cap 4-game sweeps"
324,3,91,Reuters Staff,"Oakland completed a season-series sweep of Detroit, riding the 10-strikeout pitching of Trevor Cahill and a trio of home runs to a home victory. After winning 1-0 and 2-1 to open the weekend series, the A¡¯s completed a 7-0 run through the Tigers this season, allowing them to sweep consecutive opponents in the season series. Oakland capped a 7-0 sweep of the Blue Jays with three straight wins earlier in the week. Before this week, the A¡¯s had recorded just two season-series sweeps of seven or more games in franchise history. ",2018-08-06T06:10:54+0000,"MLB roundup: Red Sox, Phillies cap 4-game sweeps"
325,3,99,Reuters Staff,"Rookie Daniel Palka, who struck out in his first four at-bats, crushed a two-run, tiebreaking homer in the ninth inning, leading Chicago past Tampa Bay in St. Petersburg, Fla., to complete a three-game sweep. Palka hit the first pitch he saw from reliever Diego Castillo (2-2), blasting a 96 mph pitch over the wall in center. The homer was preceded by Jose Abreu¡¯s single. Tampa Bay closed the score to 8-7 in the bottom of the ninth on an RBI double by Kevin Kiermaier. However, Hector Santiago (4-3) got Jesus Sucre to hit into a broken-bat, game-ending double play. ",2018-08-06T06:10:54+0000,"MLB roundup: Red Sox, Phillies cap 4-game sweeps"
326,3,102,Reuters Staff,"Jake Cave hit his first career grand slam, and Fernando Rodney picked up his 24th save as Minnesota held on for a victory and a three-game series sweep over Kansas City in Minneapolis. Max Kepler, Miguel Sano, Logan Forsythe and Robbie Grossman each had two hits and Ehire Adrianza scored two runs for Minnesota. Gabriel Moya (2-0) pitched 1 2/3 innings of hitless relief to pick up the victory. Whit Merrifield homered and had four hits and Lucas Duda also homered for Kansas City. Alex Gordon and Alcides Escobar each had two hits for the Royals, who dropped their fourth straight game. ",2018-08-06T06:10:54+0000,"MLB roundup: Red Sox, Phillies cap 4-game sweeps"
327,3,101,Reuters Staff,"Evan Longoria had three hits, including a tiebreaking homer in the eighth inning, and drove in two runs as San Francisco beat Arizona in Phoenix. Longoria had an RBI single in the third inning and doubled and scored in the sixth while extending his hitting streak to eight games. The third baseman went 7-for-18 as the Giants split the four-game series. Longoria is hitting .357 since returning from the disabled list July 26 after missing 34 games with a broken hand. Steven Souza Jr. homered for the Diamondbacks, who fell back into a tie with the Dodgers atop the NL West. ",2018-08-06T06:10:54+0000,"MLB roundup: Red Sox, Phillies cap 4-game sweeps"
328,3,93,Reuters Staff,"Matt Wieters homered, Bryce Harper added an RBI double, and Tanner Roark allowed just one run over seven innings as host Washington defeated Cincinnati. The Nationals, who had been struggling before last week, took three of four in the series. Washington has won five of its past six games. Roark (6-12) gave up seven hits and no walks while striking out two to win for the third straight time. The right-hander has allowed just two runs in 22 innings in that span, which has come at the right time for the Washington rotation. ",2018-08-06T06:10:54+0000,"MLB roundup: Red Sox, Phillies cap 4-game sweeps"
329,3,82,Reuters Staff,"Nolan Arenado homered in the top of the 11th inning, and Colorado salvaged the finale of a three-game series by winning at Milwaukee. The result snapped the Rockies¡¯ four-game losing streak. Trevor Story also homered and drove in four runs, and Scott Oberg (7-0) pitched one inning for the win. Seunghwan Oh got his first save with Colorado and third of the season. Travis Shaw and Mike Moustakas homered for the Brewers, who rallied to tie it in the ninth before falling. ",2018-08-06T06:10:54+0000,"MLB roundup: Red Sox, Phillies cap 4-game sweeps"
330,3,87,Reuters Staff,"Cory Spangenberg doubled home the tiebreaking run with two outs in the eighth inning, and Hunter Renfroe triggered a four-run ninth with a two-run homer as San Diego won at Chicago to gain a split of a four-game series. Travis Jankowski drew a two-out walk from Cubs reliever Carl Edwards Jr. in the eighth and stole second ahead of Spangenberg¡¯s double. Renfroe¡¯s ninth homer of the season immediately followed Eric Hosmer¡¯s one-out single. The Padres added two more runs on a two-run single by Jankowski off Rosario. ",2018-08-06T06:10:54+0000,"MLB roundup: Red Sox, Phillies cap 4-game sweeps"
331,3,99,Reuters Staff,"Jose Ramirez hit a three-run home run in the first inning, and Cody Allen protected a late lead by pitching out of a bases-loaded jam in the seventh, helping Cleveland hold off visiting Los Angeles. Shohei Ohtani, the focal point of the Los Angeles offense while Mike Trout sits out with a wrist injury, capped a six-hit series with a single and a double for the Angels, who lost for the sixth time in their last seven games. Allen also pitched a scoreless eighth, after which Brad Hand came on for his third save in seven games for Cleveland. ",2018-08-06T06:10:54+0000,"MLB roundup: Red Sox, Phillies cap 4-game sweeps"
332,3,72,Reuters Staff,"Matt Carpenter hit his career-high and National League-leading 29th homer, and Jedd Gyorko drove in the deciding run as St. Louis won at Pittsburgh. The Cardinals, who scored both runs in the fifth, took two of three in the series. Jack Flaherty (5-6) struck out seven in six scoreless innings, and Bud Norris pitched a perfect ninth for his 21st save. Pittsburgh¡¯s Adam Frazier was 2-for-4, including a homer in the seventh. ",2018-08-06T06:10:54+0000,"MLB roundup: Red Sox, Phillies cap 4-game sweeps"
333,3,78,Reuters Staff,"Nick Markakis capped a four-hit day by homering with one out in the 10th inning as Atlanta came back from an early three-run deficit to win at New York. The Braves took three of four from the Mets, who have lost seven of nine. Markakis¡¯ one-out homer off Tyler Bashlor (0-1) landed well beyond the fence in right-center field. It was the 13th homer of the season for Markakis, who finished 4-for-5 to raise his average to .319. ",2018-08-06T06:10:54+0000,"MLB roundup: Red Sox, Phillies cap 4-game sweeps"
