,#para,#word,author,content,time,title
223,3,155,Reuters Staff,"Ace Jacob deGrom suffered another hard-luck loss, when Ronald Acuna Jr. and Ozzie Albies doubled on consecutive pitches in the fifth inning to snap a tie and lift Atlanta to a win at New York. Johan Camargo gave the Braves the lead with a solo homer in the second off deGrom, who helped his own cause by delivering a game-tying RBI single in the third. But with two outs in the fifth, Acuna doubled to right-center for his second hit of the game and trotted home on Albies¡¯ double, which landed just fair down the left field line. That was enough for Anibal Sanchez and a trio relievers, who combined to two-hit the Mets on another night in which they provided meager support to their All-Star right-hander. New York has scored just 55 runs with deGrom on the mound this season, including 29 in his last 15 starts and nine in his last seven outings. ",2018-08-04T07:29:14+0000,MLB roundup: Red Sox top Yankees again behind Porcello's gem
224,7,241,Reuters Staff,"Adam Frazier¡¯s two-out RBI single in the eighth inning, his third hit, gave Pittsburgh a win over visiting St. Louis. It was 6-6 entering the bottom of the eighth after the Pirates blew a four-run lead. Josh Harrison got a one-out infield single against Jordan Hicks (3-3), and Jordy Mercer walked. An out later, Frazier ripped the ball up the middle to bring Harrison home. Gregory Polanco tripled and had three RBIs for Pittsburgh, which moved into third place alone in the National League Central after the clubs entered the game with identical records. Right-hander Chris Archer, making his Pirates debut, allowed five runs, four earned, and seven hits in 4 1/3 innings, with six strikeouts and four walks. White Sox 3, Rays 2 (10 innings) Yoan Moncada doubled home Adam Engel with two out in the top of the 10th inning to lift Chicago to a win at Tampa Bay in the opener of the three-game series. Nicky Delmonico doubled off Rays reliever Jose Alvarado with two out and none on in the 10th. Engel was sent in to pinch run for Delmonico and easily scored the winning run when Moncada, who is hitting under .230, doubled into the left-field corner. Chicago¡¯s extra-inning heroics made a winner out of Tyler Danish (1-0), the fifth of six pitchers for the White Sox. Hector Santiago walked one but survived the bottom of the 10th to earn his first save of the year. ",2018-08-04T07:29:14+0000,MLB roundup: Red Sox top Yankees again behind Porcello's gem
225,3,114,Reuters Staff,"Paul Goldschmidt and David Peralta homered and left-hander Patrick Corbin made his fourth quality start against San Francisco this season in Arizona¡¯s home victory. Goldschmidt hit his 200th career homer to open a five-run first inning, Peralta had three hits and reached base four times and Eduardo Escobar had two hits, including an RBI single as the Diamondbacks evened the four-game series at one game apiece. Buster Posey, Evan Longoria and Austin Slater had two hits apiece for San Francisco, which had a four-game winning streak broken. Posey left after singling in the third inning to be watched for concussion symptoms. He took a foul ball to the mask in the Diamondbacks¡¯ first inning. ",2018-08-04T07:29:14+0000,MLB roundup: Red Sox top Yankees again behind Porcello's gem
226,3,79,Reuters Staff,"Roman Quinn had a two-run double, Rhys Hoskins and Jorge Alfaro each added two hits including RBI singles and Philadelphia defeated visiting Miami. Phillies starter Vince Velasquez (8-8) allowed no runs, two hits and one walk while striking out seven in 6 1/3 innings. Seranthony Dominguez pitched around a double in 1 1/3 innings to earn his 12th save. Miami starter Trevor Richards (3-6) allowed one run, four hits and two walks and struck out seven in five innings. ",2018-08-04T07:29:14+0000,MLB roundup: Red Sox top Yankees again behind Porcello's gem
227,3,111,Reuters Staff,"Ryan Borucki pitched eight innings to earn his first major league victory as Toronto won at Seattle. Devon Travis and Russell Martin hit home runs for the Blue Jays, who have won the first two games of the series. Borucki (1-2), a rookie left-hander making his seventh start, allowed one unearned run on four hits. He didn¡¯t walk a batter and struck out two. Closer Ken Giles made his Blue Jays debut after being acquired from Houston, allowing a run in the ninth. It was the second consecutive night a Blue Jays pitcher got his first big-league win, after Mike Hauschild accomplished the feat Thursday with six scoreless innings of relief. ",2018-08-04T07:29:14+0000,MLB roundup: Red Sox top Yankees again behind Porcello's gem
228,3,145,Reuters Staff,"Miguel Sano had two hits and two RBIs, and reliever Gabriel Moya picked up his first major league victory as Minnesota snapped a two-game losing streak with a soggy victory over visiting Kansas City. Eddie Rosario and Jorge Polanco each had two hits for the Twins in a contest that featured two rain delays totaling two hours and 24 minutes. Moya (1-0) got the win despite allowing two runs on four hits in 1 2/3 innings of relief. Fernando Rodney pitched a 1-2-3 ninth to earn his 23rd save in a contest that ended at 12:56 on Saturday morning. Whit Merrifield had three hits and scored two runs, Salvador Perez had a two-run homer and Alex Gordon added two hits and an RBI for Kansas City. Brian Flynn (2-3), who allowed three runs on five hits in 2 1/3 innings of relief, took the loss. ",2018-08-04T07:29:14+0000,MLB roundup: Red Sox top Yankees again behind Porcello's gem
229,3,117,Reuters Staff,"Rougned Odor hit a grand slam, and Joey Gallo and Robinson Chirinos also homered during a seven-run fourth inning as Texas beat visiting Baltimore. Odor¡¯s third career slam was the capper to the big fourth inning and propelled the Rangers to an eight-run lead. He scored twice and had two hits, and Texas had 10 hits overall while winning for the sixth time in its past seven games. The Rangers have slugged six homers and scored 28 runs while winning the first two contests of the four-game series. Jonathan Villar went 3-for-5 with an RBI for Baltimore, which is a major league-worst 13-42 on the road. The Orioles have dropped 13 of their past 14 away games. ",2018-08-04T07:29:14+0000,MLB roundup: Red Sox top Yankees again behind Porcello's gem
230,3,54,Reuters Staff,"Cincinnati¡¯s game at Washington was postponed because of weather. The game will be made up as part of a split doubleheader on Saturday, with Game 1 slated for a 1:05 p.m. ET start. The regularly scheduled game is slated for 7:05 p.m. The Nationals defeated the Reds 10-4 in the series opener on Thursday. ",2018-08-04T07:29:14+0000,MLB roundup: Red Sox top Yankees again behind Porcello's gem
231,4,124,Reuters Staff,"David Bote slugged a pinch-hit, walk-off grand slam with two outs in the bottom of the ninth inning to give the Chicago Cubs a dramatic 4-3 victory over the Washington Nationals on Sunday night at Wrigley Field. Bote hammered a low 2-2 fastball from Washington right-hander Ryan Madson (2-5) well over the fence in center field to turn an apparent shutout loss into a memorable victory. The stunning turnaround boosted Chicago¡¯s lead in the National League Central to three games over the second-place Milwaukee Brewers. Washington was in good shape entering the ninth after right-hander Max Scherzer struck out 11 over seven shutout innings, Mark Reynolds hit a sacrifice fly and Ryan Zimmerman delivered a two-run single to give the Nationals a 3-0 edge. ",2018-08-13T05:28:27+0000,MLB roundup: Cubs PH Bote hits walk-off slam
232,3,69,Reuters Staff,"Chris Sale returned from the disabled list in style, striking out 12 in five innings, and Steve Pearce homered as Boston completed a four-game sweep at Baltimore. Sale, back from shoulder inflammation, made his first start since July 27. The left-hander did not allow a run and gave up just one hit and no walks. Sale (12-4) fanned at least two each inning. He has won seven consecutive decisions. ",2018-08-13T05:28:27+0000,MLB roundup: Cubs PH Bote hits walk-off slam
233,3,105,Reuters Staff,"Chris Iannetta drew a bases-loaded walk in the bottom of the ninth inning, and Colorado beat Los Angeles in Denver. Charlie Blackmon homered, DJ LeMahieu scored twice, including the winning run, and Wade Davis (2-6) got the win with a scoreless inning of relief. In the ninth, LeMahieu hit a leadoff single off Dylan Floro (4-3) and went to second on an error by Dodgers right fielder Yasiel Puig. A strikeout, an intentional walk, a groundout and another intentional walk loaded the bases. Floro then walked Iannetta on five pitches to give Colorado its third consecutive win and second in a row in walk-off fashion. ",2018-08-13T05:28:27+0000,MLB roundup: Cubs PH Bote hits walk-off slam
234,3,108,Reuters Staff,"Mitch Haniger capped a terrific series with an RBI double in the 10th inning as Seattle completed a four-game sweep at Houston. Haniger drove home Dee Gordon with his hit off Roberto Osuna (1-1) and closed the series 9-for-17 batting from the leadoff spot. Gordon stroked a one-out single off Osuna to start the rally and set the table for Mariners closer Edwin Diaz to record his 46th save on the season and fourth of the series. Seattle drew to within four games of the Astros in the American League West. Houston has been swept in consecutive series at home, dropping eight straight games at Minute Maid Park. ",2018-08-13T05:28:27+0000,MLB roundup: Cubs PH Bote hits walk-off slam
235,3,100,Reuters Staff,"Jed Lowrie¡¯s two-run home run capped a four-run fourth inning to help lift Oakland past Los Angeles in Anaheim, Calif. Lowrie also doubled in the game as part of Oakland¡¯s 12-hit attack. Marcus Semien had three hits while Nick Martini and Matt Olson each added two more. The A¡¯s won two of three in the series and moved to within 2 1/2 games of the Houston Astros for first place in the American League West. Fernando Rodney (4-2), the fifth of six Oakland relievers, got the victory in his second appearance with Oakland after being traded from Minnesota on Thursday. ",2018-08-13T05:28:27+0000,MLB roundup: Cubs PH Bote hits walk-off slam
236,3,89,Reuters Staff,"Dereck Rodriguez limited Pittsburgh to one run in seven innings, pitching host San Francisco Giants to a victory. Nick Hundley and Joe Panik drove in two runs apiece for the Giants, who salvaged a split in the four-game series. Rodriguez (6-1) allowed a second-inning run on doubles by Josh Bell and Elias Diaz, the only two hits he allowed in his outing. He left with a 4-1 lead, having walked one and struck out four. The win was the fifth straight for Rodriguez, who hasn¡¯t lost since June 9. ",2018-08-13T05:28:27+0000,MLB roundup: Cubs PH Bote hits walk-off slam
237,3,86,Reuters Staff,"Freddy Galvis hit the first grand slam of his career, and Joey Lucchesi blanked Philadelphia over six innings as host San Diego won the rubber match of a three-game series. The win gave the Padres a 3-3 split of the season series against Philadelphia, which slipped back into a tie with Atlanta for the National League East lead. Lucchesi (6-6) allowed two hits and three walks with six strikeouts. Travis Jankowski and Eric Hosmer each had two hits for the Padres, and Jankowski scored three runs. ",2018-08-13T05:28:27+0000,MLB roundup: Cubs PH Bote hits walk-off slam
238,3,104,Reuters Staff,"Yadier Molina hit a bases-loaded, two-run single in the seventh inning, and Tyson Ross pitched six innings in his debut for St. Louis, which completed a three-game sweep at Kansas City, Mo. Ross (7-9) made his first start since Aug. 3 after being acquired off waivers from San Diego last week. He allowed two runs on four hits. He was pressed into action when originally scheduled starter Luke Weaver was scratched due to an injured right hand. Molina¡¯s hit helped the Cardinals win their fifth consecutive game and improve to 17-9 since interim manager Mike Shildt took over for Mike Matheny on July 15. ",2018-08-13T05:28:27+0000,MLB roundup: Cubs PH Bote hits walk-off slam
239,3,91,Reuters Staff,"Giancarlo Stanton homered again, CC Sabathia allowed just one hit in six scoreless innings, and New York dumped visiting Texas. Stanton homered in the first inning for the second straight game and for the fifth time in six games. Limited to starting as the designated hitter because of left hamstring tightness, Stanton reached 30 homers for the fifth time in his career. Sabathia (7-4) allowed only an infield single in the second inning. He struck out seven and walked three as the Yankees won for the sixth time in seven games. ",2018-08-13T05:28:27+0000,MLB roundup: Cubs PH Bote hits walk-off slam
240,3,82,Reuters Staff,"Melky Cabrera went 2-for-4 with a home run and three RBIs, and Cleveland held on for a win at Chicago. Jason Kipnis and Yandy Diaz drove in two runs apiece for the Indians, who erupted for 14 hits. Cleveland claimed the series and has won seven of its past nine games. Adam Engel tripled, homered and drove in three runs for Chicago. Yolmer Sanchez also homered for the White Sox, who rallied with four runs in the ninth inning but fell short. ",2018-08-13T05:28:27+0000,MLB roundup: Cubs PH Bote hits walk-off slam
241,3,74,Reuters Staff,Ozzie Albies¡¯ seventh-inning solo shot was the deciding blow as Atlanta edged visiting Milwaukee. Albies connected on the second pitch from Dan Jennings (4-4) for his 21st homer of the season. The Braves won two of the three games in the series. Atlanta also got two-run homers from Ronald Acuna Jr. and Dansby Swanson. Jonny Venters (2-1) earned his first victory with the Braves since being acquired from Tampa Bay at the trade deadline. ,2018-08-13T05:28:27+0000,MLB roundup: Cubs PH Bote hits walk-off slam
242,3,107,Reuters Staff,"Paul Goldschmidt hit two of Arizona¡¯s five homers, and Zack Godley won his fourth consecutive decision as the Diamondbacks won at Cincinnati to salvage the finale of a three-game series. Daniel Descalso hit a three-run homer in the first inning to give the Diamondbacks a lead they never lost. Goldschmidt hit a two-run homer in the sixth inning, and Eduardo Escobar, Goldschmidt and David Peralta all homered in a four-run ninth. Descalso and Goldschmidt also doubled and had three RBIs apiece, and Jon Jay had two singles and scored twice as the Diamondbacks remained atop the NL West. Peralta has five homers in his last 10 games. ",2018-08-13T05:28:27+0000,MLB roundup: Cubs PH Bote hits walk-off slam
243,3,83,Reuters Staff,"Matt Boyd allowed only three baserunners in six innings, and Jeimer Candelario had two hits, a run and an RBI as Detroit downed visiting Minnesota. Boyd (7-10) limited the Twins to one run, two hits and a walk while striking out three. Shane Greene pitched the ninth for his 25th save as Detroit took two of three during the weekend series. Twins starter Kohl Stewart (0-1) was charged with three runs on eight hits in 4 1/3 innings during his major league debut. ",2018-08-13T05:28:27+0000,MLB roundup: Cubs PH Bote hits walk-off slam
244,3,68,Reuters Staff,"Jose Reyes and Michael Conforto homered to lead New York to a win at Miami. Reyes hit a two-run shot, and Conforto hit a solo shot. Noah Syndergaard (8-2) allowed seven hits, two walks and three runs in seven innings, striking out seven. He is 5-0 with a 1.96 ERA in seven career starts against Miami. Seth Lugo pitched a scoreless ninth to earn his first career save. ",2018-08-13T05:28:27+0000,MLB roundup: Cubs PH Bote hits walk-off slam
245,3,69,Reuters Staff,"Toronto avoided a three-game sweep at the hands of visiting Tampa Bay thanks to a two-run sixth inning. Devon Travis and Randal Grichuk picked up the RBIs in the decisive rally. Jaime Garcia (3-6) pitched a perfect sixth in relief, striking out two, to earn the win. Ken Giles pitched a flawless ninth to earn his first save with the Blue Jays after having 12 with the Houston Astros. ",2018-08-13T05:28:27+0000,MLB roundup: Cubs PH Bote hits walk-off slam
246,4,145,Reuters Staff,"Mookie Betts led off the bottom of the 10th inning with a home run as the Boston Red Sox snapped a two-game losing streak with a 4-3 victory over the visiting Minnesota Twins on Friday night at Fenway Park. It was Betts¡¯ 25th homer of the season and his first career walk-off homer. The blast over the Green Monster in left field came on the second pitch of the inning from Matt Belisle (1-1). Eddie Rosario had a two-run go-ahead double off Red Sox closer Craig Kimbrel with two outs in the ninth, and Jorge Polanco also had two hits for Minnesota, which had a four-game winning streak snapped. Rafael Devers tied the game leading off the bottom of the ninth against Fernando Rodney when he lined his 15th homer of the year just over the glove of Max Kepler into the bullpen in right. ",2018-07-28T06:47:16+0000,MLB roundup: Betts' first walk-off HR caps wild Red Sox win
247,3,90,Reuters Staff,"David Freese capped a big night with a walk-off single as Pittsburgh broke a two-game losing streak with a win over visiting New York. Freese drove in all five Pirates runs, including a two-run homer. Michael Conforto hit a three-run homer for the Mets, who had their three-game winning streak snapped. In the ninth tied 4-4 against Tim Peterson (2-2), the Mets¡¯ seventh pitcher, Josh Harrison had an infield single, Gregory Polanco singled and Elias Diaz was walked intentionally before Freese lofted the ball to deep right-center for the win. ",2018-07-28T06:47:16+0000,MLB roundup: Betts' first walk-off HR caps wild Red Sox win
248,3,101,Reuters Staff,"Adam Jones homered and drove in four runs, and Jonathan Schoop homered in a fifth consecutive game and had three RBIs as Baltimore routed visiting Tampa Bay. Andrew Cashner (3-9) broke a four-game losing streak and won for the first time this season at home. It was his first victory since May 21. Chris Archer (3-5) started for the Rays in what might have been his final time on the mound with Tampa Bay as the July 31 trade deadline nears. Archer gave up four runs (three earned) in six innings before the Orioles broke things open with an eight-run seventh. ",2018-07-28T06:47:16+0000,MLB roundup: Betts' first walk-off HR caps wild Red Sox win
249,3,88,Reuters Staff,"Pinch hitter Brandon Guyer smashed a three-run homer to highlight a four-run eighth, Francisco Lindor homered twice and drove in three runs and Cleveland rolled to a win at Detroit. Yonder Alonso also homered and drove in two runs for the Indians, who have won 11 of 14 meetings with Detroit this season. Cody Allen (3-4) pitched 1 1/3 innings of scoreless relief to get the victory. Victor Martinez homered for the Tigers. Losing pitcher Joe Jimenez (4-2) was charged with three runs while getting only one out. ",2018-07-28T06:47:16+0000,MLB roundup: Betts' first walk-off HR caps wild Red Sox win
250,3,78,Reuters Staff,"Mason Williams broke a fourth-inning tie with a three-run home run and Eugenio Suarez homered in his fifth straight game, lifting host Cincinnati past Philadelphia. Suarez tied a club record when he connected for a solo shot in the second inning. He became the eighth Reds player to homer in five straight, last accomplished by Jay Bruce in 2016. The Cincinnati bullpen threw 4 2/3 innings of one-run relief, helping the Reds get even in the four-game series. ",2018-07-28T06:47:16+0000,MLB roundup: Betts' first walk-off HR caps wild Red Sox win
251,3,93,Reuters Staff,"Max Scherzer earned his 14th win of the season on his 34th birthday and teenager Juan Soto homered for the third straight game as Washington defeated host Miami. The only run allowed by Scherzer was unearned, and Soto went 3-for-5 with three RBIs. Soto finished a double short of the cycle. Scherzer (14-5) retired the first 10 batters he faced and struck out the side in the third and sixth innings. He finished with 11 strikeouts to reach 200 on the season and gave up three hits and one walk in eight innings. ",2018-07-28T06:47:16+0000,MLB roundup: Betts' first walk-off HR caps wild Red Sox win
252,3,110,Reuters Staff,"Clayton Kershaw gave up one run over a season-high 7 2/3 innings and drove in a pair of runs to help Los Angeles win at Atlanta. Kershaw (4-5) gave up six hits, struck out eight without a walk and improved to 4-0 in 10 career starts against the Braves. It was his first career start at SunTrust Park. Kershaw drove in two runs with a two-out single in the fourth inning to complete a three-run rally. He also walked three times, making him the first pitcher with three walks and a single since Whitey Ford in 1959 and the first Dodger pitcher with three walks since Don Sutton in 1976. ",2018-07-28T06:47:16+0000,MLB roundup: Betts' first walk-off HR caps wild Red Sox win
253,3,64,Reuters Staff,"Lourdes Gurriel Jr. led a five-homer barrage with two solo shots, Marcus Stroman pitched into the seventh inning and visiting Toronto pummeled Chicago. Randal Grichuk hit a two-run homer, and Curtis Granderson and Kendrys Morales each added solo blasts for the Jays. Gurriel also hit a double in going 3-for-5 and matching a club record (Tony Fernandez, 1986) with his ninth straight multi-hit game. ",2018-07-28T06:47:16+0000,MLB roundup: Betts' first walk-off HR caps wild Red Sox win
254,3,84,Reuters Staff,"Robinson Chirinos slugged his third home run against Houston this season, leading visiting Texas in a rout. Chirinos delivered the decisive blow with two outs and a 2-2 count in the fifth inning, belting a fastball from Astros left-hander Dallas Keuchel (8-9) 404 feet to left field. The Astros, playing without middle infielders Carlos Correa (back) and Jose Altuve (right knee), managed only two hits against Yovani Gallardo (5-1) in 5 1/3 innings after mustering just one off Rockies right-hander Jon Gray on Wednesday. ",2018-07-28T06:47:16+0000,MLB roundup: Betts' first walk-off HR caps wild Red Sox win
255,3,82,Reuters Staff,"Luke Weaver pitched six strong innings as St. Louis defeated visiting Chicago. Paul DeJong went 3-for-3 with a triple and three RBIs for the Cardinals, who improved to 8-6 in the season series against the National League Central leaders. Weaver (6-9) allowed two runs on eight hits. He didn¡¯t walk a batter and struck out five to defeat the Cubs for the first time in four tries this season. He suffered a 7-2 loss last Saturday in Chicago in his previous start. ",2018-07-28T06:47:16+0000,MLB roundup: Betts' first walk-off HR caps wild Red Sox win
256,3,79,Reuters Staff,"Kyle Freeland pitched six shutout innings, Nolan Arenado homered and host Colorado beat streaking Oakland. Adam Ottavino pitched the ninth for his fourth save, and Carlos Gonzalez had three hits for the Rockies, who have won eight of 10. The A¡¯s had won 13 of their last 16 games to move to 18 games above .500 and climb into the playoff hunt. Heading into the weekend, Oakland was a game behind Seattle for the second American League wild card. ",2018-07-28T06:47:16+0000,MLB roundup: Betts' first walk-off HR caps wild Red Sox win
257,3,76,Reuters Staff,"Kole Calhoun hit a game-ending home run in the 10th inning to lead Los Angeles past visiting Seattle. Calhoun¡¯s 12th home run of the season came on the first pitch against Mariners reliever Juan Nicasio (1-5). Albert Pujols had a second-inning double to give him 3,061 hits and move him past Craig Biggio and into sole possession of 24th on the all-time hit list. Next up at No. 23 is Ichiro Suzuki, who has 3,089 hits. ",2018-07-28T06:47:16+0000,MLB roundup: Betts' first walk-off HR caps wild Red Sox win
258,3,104,Reuters Staff,"Arizona erupted for six runs in the third inning off San Diego starter Luis Perdomo, and right-hander Zack Greinke held the hosts to a solo homer by Manuel Margot over seven innings in a win. Greinke improved to 12-5 on the season ¡ª and 11-2 lifetime against the Padres ¡ª while giving up six hits and no walks with six strikeouts. Steven Souza Jr.¡¯s two-run double ¡ª one of four in the inning ¡ª was Arizona¡¯s biggest hit in the third-inning assault on Perdomo, who got only one out in the inning before being pulled. Seven straight Diamondbacks reached base ahead of his departure. ",2018-07-28T06:47:16+0000,MLB roundup: Betts' first walk-off HR caps wild Red Sox win
259,3,77,Reuters Staff,"Chase Anderson outdueled Madison Bumgarner and Ryan Braun drove in two runs, delivering Milwaukee a win at San Francisco. Jeremy Jeffress got Buster Posey to ground out with the bases loaded and two outs in the eighth inning, helping the Brewers hold on for their fourth win in their last five games. Following the win, the Brewers acquired two-time All-Star third baseman Mike Moustakas from the Kansas City Royals for outfielder Brett Phillips and right-hander Jorge Lopez. ",2018-07-28T06:47:16+0000,MLB roundup: Betts' first walk-off HR caps wild Red Sox win
260,1,37,Reuters Staff,The game between Kansas City and New York at Yankee Stadium was postponed roughly 30 minutes after its scheduled first pitch due to rain. The contest will be made up as part of a day-night doubleheader Saturday. ,2018-07-28T06:47:16+0000,MLB roundup: Betts' first walk-off HR caps wild Red Sox win
